{
  "meta": {
    "project_key": "client_abc",
    "client_name": "Client ABC GmbH",
    "period": "2026-01",
    "generated_at": "2026-02-02T12:00:00+00:00",
    "timezone": "Europe/Helsinki",
    "report_language": "de"
  },
  "missing_sources": [
    "rankings"
  ],
  "warnings": [
    "CrUX: Field data not available for all pages."
  ],
  "data_completeness_score": 82.5,
  "kpis": {
    "gsc": {
      "clicks": 1234,
      "clicks_mom_pct": 0.082,
      "impressions": 45678,
      "impressions_mom_pct": 0.051,
      "ctr": 0.027,
      "ctr_mom_pct": 0.02,
      "avg_position": 18.4,
      "avg_position_delta": -0.6
    },
    "cwv": {
      "lcp_p75_ms": 2500,
      "inp_p75_ms": 180,
      "cls_p75": 0.08,
      "status": "needs_improvement"
    }
  },
  "actions": [
    {
      "id": "ACT_MISSING_SOURCES",
      "title": "Datenquellen reparieren (Zugriff/Keys)",
      "reason": "Mindestens eine Datenquelle fehlt oder ist nicht abrufbar: rankings. Ohne diese Daten ist der Report nur eingeschränkt aussagekräftig.",
      "severity": "critical",
      "data_refs": [
        "missing_sources",
        "warnings"
      ]
    },
    {
      "id": "ACT_TRAFFIC_DROP",
      "title": "Klick-Rückgang analysieren (Ursachen eingrenzen)",
      "reason": "Klicks sind gegenüber dem Vormonat deutlich gefallen (MoM: 0.082). Prüfe zuerst die Verlierer-Seiten/Queries und Änderungen an Snippets/Indexierung.",
      "severity": "critical",
      "data_refs": [
        "kpis.gsc.clicks_mom_pct",
        "insights.losers_pages",
        "insights.losers_queries"
      ]
    },
    {
      "id": "ACT_CTR_OPT",
      "title": "CTR optimieren (Snippets & Intent)",
      "reason": "CTR ist niedrig (0.027) bei gleichzeitig hohem Impressions-Volumen. Priorisiere Seiten/Queries mit vielen Impressionen und optimiere Title/Meta/USP.",
      "severity": "warn",
      "data_refs": [
        "kpis.gsc.ctr",
        "kpis.gsc.impressions",
        "insights.top_pages",
        "insights.top_queries"
      ]
    },
    {
      "id": "ACT_CWV_REGRESSION",
      "title": "Core Web Vitals verbessern (Performance-Regression)",
      "reason": "CWV Status ist nicht 'good' (needs_improvement). Priorisiere INP/LCP/CLS-Fixes auf den wichtigsten Seiten (Top Pages).",
      "severity": "warn",
      "data_refs": [
        "kpis.cwv.status",
        "kpis.cwv.lcp_p75_ms",
        "kpis.cwv.inp_p75_ms",
        "kpis.cwv.cls_p75",
        "insights.top_pages"
      ]
    },
    {
      "id": "ACT_TECH_HYGIENE",
      "title": "Technische Hygiene (Indexierung & interne Qualitätssignale)",
      "reason": "Standard-Checks: Indexierbarkeit wichtiger Seiten, Canonicals, 404/Redirect-Ketten, Sitemap/Robots, interne Verlinkung auf Kernseiten.",
      "severity": "info",
      "data_refs": [
        "meta.period"
      ]
    }
  ],
  "insights": {
    "top_pages": [
      {
        "url": "https://www.example.com/leistungen/",
        "clicks": 340,
        "clicks_mom_pct": null,
        "impressions": null,
        "ctr": null,
        "avg_position": null
      }
    ],
    "top_queries": [
      {
        "query": "seo agentur",
        "clicks": 210,
        "clicks_mom_pct": null,
        "impressions": null,
        "ctr": null,
        "avg_position": null
      }
    ]
  }
}
